{
  "isoDate": "2025-05-05",
  "image": "/images/news/news-4.jpg",
  "type": "announcement",
  "en": {
    "title": "Krivda — Officially Announced",
    "date": "May 05, 2025",
    "summary": "Our second title enters concept stage. A cooperative survival game rooted in Slavic mythology — explore an open world of secrets, spirits, and ancient dangers.",
    "body": "Krivda — the old Slavic word for injustice, or the spirit that embodies it — is our second game and our most ambitious.\n\nWhere Frog Frag is loud and immediate, Krivda is slow and atmospheric. It's a cooperative survival game set in a handcrafted open world drawn from Slavic folklore: dense forests where the trees remember, rivers with their own moods, villages that vanish by morning.\n\nUp to four players share a persistent world. Hunger, cold, and exhaustion are mechanics, but so are ritual, reputation, and the alignment of the spirit world.\n\nWe're in early concept stage. Follow us — the development of Krivda will be documented from the very first sketch."
  },
  "ru": {
    "title": "Кривда — официальный анонс",
    "date": "05 Май, 2025",
    "summary": "Наш второй проект входит в стадию концепта. Кооперативный симулятор выживания в духе славянской мифологии — исследуйте открытый мир тайн, духов и древних опасностей.",
    "body": "Кривда — старославянское слово, обозначающее несправедливость или дух, её олицетворяющий — наша вторая игра и самая амбициозная.\n\nЕсли Frog Frag громкий и моментальный, то Кривда медленная и атмосферная. Кооперативный симулятор выживания в рукотворном открытом мире: густые леса, где деревья помнят, реки со своим настроением, деревни, исчезающие к утру.\n\nДо четырёх игроков делят один постоянный мир. Голод, холод и усталость — механики. Но ритуал, репутация и расположение мира духов — тоже.\n\nМы на стадии раннего концепта. Следите — разработка Кривды будет задокументирована с самого первого эскиза."
  }
}
